{
  "$id": "urn:usfs-r1-ea-sources:schemas:project-sow-intake-v0",
  "$schema": "https://json-schema.org/draft/2020-12/schema",
  "additionalProperties": true,
  "description": "Structured proposed-action intake used by the project SOW requirements package generator. This schema covers the tracked JSON shape; runtime validation also checks resource-scope resolution and canonical graph path readiness against repository config.",
  "properties": {
    "consultation_indicators": {
      "items": {
        "type": "string"
      },
      "type": "array"
    },
    "districts": {
      "items": {
        "type": "string"
      },
      "minItems": 1,
      "type": "array"
    },
    "draft_metadata": {
      "additionalProperties": true,
      "description": "Metadata for an intake drafted from proposed-action text. Presence of this object means runtime validation requires explicit reviewer confirmation before package generation.",
      "properties": {
        "candidate_federal_land_action_types": {
          "items": {
            "type": "string"
          },
          "type": "array"
        },
        "candidate_resource_area_ids": {
          "items": {
            "type": "string"
          },
          "type": "array"
        },
        "draft_notice": {
          "type": "string"
        },
        "review_status": {
          "enum": [
            "unreviewed",
            "reviewer_confirmed"
          ],
          "type": "string"
        },
        "reviewer_confirmation_required": {
          "type": "boolean"
        },
        "schema_version": {
          "const": "project-sow-intake-draft-v0"
        },
        "source_text_path": {
          "type": "string"
        },
        "source_text_sha256": {
          "pattern": "^[a-f0-9]{64}$",
          "type": "string"
        },
        "uncertainty_flags": {
          "items": {
            "type": "string"
          },
          "type": "array"
        }
      },
      "required": [
        "schema_version",
        "review_status",
        "reviewer_confirmation_required",
        "candidate_federal_land_action_types",
        "candidate_resource_area_ids",
        "source_text_path",
        "source_text_sha256",
        "uncertainty_flags"
      ],
      "type": "object"
    },
    "federal_land_actions": {
      "items": {
        "additionalProperties": true,
        "properties": {
          "action_type": {
            "type": "string"
          },
          "description": {
            "type": "string"
          }
        },
        "required": [
          "action_type",
          "description"
        ],
        "type": "object"
      },
      "minItems": 1,
      "type": "array"
    },
    "forest": {
      "type": "string"
    },
    "forest_plan_profile": {
      "type": "string"
    },
    "geography": {
      "items": {
        "type": "string"
      },
      "type": "array"
    },
    "management_context": {
      "items": {
        "type": "string"
      },
      "type": "array"
    },
    "nepa_level": {
      "type": "string"
    },
    "observed_specialist_reports": {
      "items": {
        "$ref": "#/$defs/observed_specialist_report"
      },
      "type": "array"
    },
    "project_id": {
      "type": "string"
    },
    "project_name": {
      "type": "string"
    },
    "project_type": {
      "type": "string"
    },
    "project_sow_adjudication": {
      "additionalProperties": true,
      "description": "Replay metadata written by project-sow-adjudication-apply. This records reviewer adjudication of planning worklist items without creating applicability decisions, compliance findings, legal advice, legal sufficiency conclusions, or final agency decisions.",
      "properties": {
        "adjudication_id": {
          "type": "string"
        },
        "adjudication_path": {
          "type": "string"
        },
        "applied_at": {
          "type": "string"
        },
        "decision_counts": {
          "additionalProperties": {
            "type": "integer"
          },
          "type": "object"
        },
        "eval_output_path": {
          "type": "string"
        },
        "input_hashes": {
          "additionalProperties": {
            "type": "string"
          },
          "type": "object"
        },
        "item_count": {
          "type": "integer"
        },
        "items": {
          "items": {
            "additionalProperties": true,
            "properties": {
              "adjudicated_at": {
                "type": "string"
              },
              "adjudicated_by": {
                "items": {
                  "type": "string"
                },
                "type": "array"
              },
              "decision": {
                "enum": [
                  "accepted",
                  "rejected",
                  "needs_information",
                  "out_of_scope"
                ],
                "type": "string"
              },
              "decision_source": {
                "type": "string"
              },
              "item_id": {
                "type": "string"
              },
              "item_type": {
                "enum": [
                  "calibration_gap",
                  "missing_evidence_ref",
                  "optional_deliverable_decision",
                  "unknown_resource_area_id",
                  "unresolved_resource_area"
                ],
                "type": "string"
              },
              "rationale": {
                "type": "string"
              }
            },
            "required": [
              "item_id",
              "item_type",
              "decision",
              "rationale",
              "adjudicated_by",
              "adjudicated_at",
              "decision_source"
            ],
            "type": "object"
          },
          "type": "array"
        },
        "reviewer_metadata": {
          "additionalProperties": true,
          "properties": {
            "review_status": {
              "const": "complete"
            },
            "review_source": {
              "type": "string"
            },
            "reviewed_at": {
              "type": "string"
            },
            "reviewed_by": {
              "items": {
                "type": "string"
              },
              "type": "array"
            }
          },
          "required": [
            "review_status",
            "reviewed_at",
            "reviewed_by",
            "review_source"
          ],
          "type": "object"
        },
        "schema_version": {
          "const": "project-sow-intake-adjudication-v0"
        },
        "status": {
          "enum": [
            "adjudicated",
            "adjudicated_needs_information",
            "not_required"
          ],
          "type": "string"
        }
      },
      "required": [
        "schema_version",
        "status",
        "adjudication_id",
        "applied_at",
        "decision_counts",
        "item_count",
        "items",
        "reviewer_metadata"
      ],
      "type": "object"
    },
    "proponent": {
      "type": "string"
    },
    "proposed_action_elements": {
      "items": {
        "$ref": "#/$defs/proposed_action_element"
      },
      "minItems": 1,
      "type": "array"
    },
    "proposed_action_summary": {
      "type": "string"
    },
    "resource_analysis_expectations": {
      "items": {
        "$ref": "#/$defs/resource_analysis_expectation"
      },
      "type": "array"
    },
    "resource_indicators": {
      "additionalProperties": {
        "items": {
          "type": "string"
        },
        "type": "array"
      },
      "type": "object"
    },
    "schema_version": {
      "const": "project-sow-intake-v0"
    }
  },
  "required": [
    "schema_version",
    "project_id",
    "project_name",
    "forest",
    "districts",
    "project_type",
    "nepa_level",
    "proposed_action_summary",
    "federal_land_actions",
    "proposed_action_elements"
  ],
  "title": "Project SOW Intake v0",
  "type": "object",
  "$defs": {
    "evidence_ref": {
      "additionalProperties": true,
      "properties": {
        "citation_label": {
          "type": "string"
        },
        "evidence_ref_id": {
          "type": "string"
        },
        "locator": {
          "type": "string"
        },
        "source_record_id": {
          "type": "string"
        },
        "summary": {
          "type": "string"
        },
        "title": {
          "type": "string"
        }
      },
      "required": [
        "evidence_ref_id",
        "locator",
        "source_record_id",
        "summary",
        "title"
      ],
      "type": "object"
    },
    "observed_specialist_report": {
      "additionalProperties": true,
      "properties": {
        "document_role": {
          "type": "string"
        },
        "evidence_refs": {
          "items": {
            "$ref": "#/$defs/evidence_ref"
          },
          "type": "array"
        },
        "report_id": {
          "type": "string"
        },
        "resource_area_ids": {
          "items": {
            "type": "string"
          },
          "minItems": 1,
          "type": "array"
        },
        "source_record_id": {
          "type": "string"
        },
        "title": {
          "type": "string"
        }
      },
      "required": [
        "report_id",
        "resource_area_ids",
        "title"
      ],
      "type": "object"
    },
    "proposed_action_element": {
      "additionalProperties": true,
      "properties": {
        "action_element_id": {
          "type": "string"
        },
        "description": {
          "type": "string"
        },
        "evidence_refs": {
          "items": {
            "$ref": "#/$defs/evidence_ref"
          },
          "minItems": 1,
          "type": "array"
        },
        "resource_area_ids": {
          "items": {
            "type": "string"
          },
          "minItems": 1,
          "type": "array"
        },
        "resource_indicator_keys": {
          "items": {
            "type": "string"
          },
          "type": "array"
        }
      },
      "required": [
        "action_element_id",
        "description",
        "evidence_refs",
        "resource_area_ids"
      ],
      "type": "object"
    },
    "resource_analysis_expectation": {
      "additionalProperties": true,
      "properties": {
        "proposed_action_basis": {
          "items": {
            "type": "string"
          },
          "type": "array"
        },
        "resource_area_id": {
          "type": "string"
        },
        "resource_area_name": {
          "type": "string"
        }
      },
      "required": [
        "resource_area_id",
        "resource_area_name"
      ],
      "type": "object"
    }
  }
}
